{"schema":"pitcheezy-service-games-v2","source":{"kind":"archive","session_id":null},"date":"2026-10-27","games":[],"live_ok":true,"features":{"provisional":true,"viewer_delay":{"enabled":false,"default_s":30,"sync_prompt":false,"fold_actual_until_synced":false},"profile_reference":{"enabled":true},"step5_expectation":{"enabled":false}},"publish":{"contract":"v1","sequence":1726,"published_at":"2026-10-28T04:17:34Z"}}