{"schema":"pitcheezy-service-games-v2","source":{"kind":"archive","session_id":null},"date":"2026-10-28","games":[{"game_pk":849803,"start":"2026-10-28T00:00:00Z","start_kst":"2026-10-28T09:00:00+09:00","date_kst":"2026-10-28","official_date":"2026-10-27","status":"live","status_text":"In Progress","live":true,"away_team":"Milwaukee Brewers","home_team":"Tampa Bay Rays","game_type":"W","series_description":null,"series_game_number":null,"games_in_series":null,"probable_pitchers":{"away":null,"home":null},"venue":null,"away_abbr":null,"home_abbr":null,"away_score":3,"home_score":2,"inning":null,"half":null,"game_number":1,"double_header":false,"double_header_code":"N","embargoed":false,"has_history":true}],"live_ok":true,"features":{"provisional":true,"viewer_delay":{"enabled":false,"default_s":30,"sync_prompt":false,"fold_actual_until_synced":false},"profile_reference":{"enabled":true},"step5_expectation":{"enabled":false}},"publish":{"contract":"v1","sequence":1726,"published_at":"2026-10-28T04:17:34Z"}}