{"schema":"pitcheezy-service-games-v2","source":{"kind":"archive","session_id":null},"date":"2026-10-24","games":[{"game_pk":849805,"start":"2026-10-24T00:00:00Z","start_kst":"2026-10-24T09:00:00+09:00","date_kst":"2026-10-24","official_date":"2026-10-23","status":"final","status_text":"Final","live":false,"away_team":"Tampa Bay Rays","home_team":"Milwaukee Brewers","game_type":"W","series_description":"World Series","series_game_number":1,"games_in_series":7,"probable_pitchers":{"away":null,"home":null},"venue":"American Family Field","away_abbr":null,"home_abbr":null,"away_score":2,"home_score":3,"inning":null,"half":null,"game_number":1,"double_header":false,"double_header_code":"N","embargoed":false,"has_history":true}],"live_ok":true,"features":{"provisional":true,"viewer_delay":{"enabled":false,"default_s":30,"sync_prompt":false,"fold_actual_until_synced":false},"profile_reference":{"enabled":true},"step5_expectation":{"enabled":false}},"publish":{"contract":"v1","sequence":1492,"published_at":"2026-10-24T03:41:52Z"}}